{
  "schema": "retrolarium.game-profile",
  "schema_version": 1,
  "profile_version": 1,
  "id": "castle-excellent",
  "name": "Castle Excellent / Castlequest",
  "platform": "nes",
  "capabilities": [
    "rooms",
    "objects",
    "graphics",
    "animations",
    "screens",
    "text",
    "audio",
    "fixed-arena-write",
    "exact-round-trip"
  ],
  "revisions": [
    {
      "id": "castle-excellent-japan-hsp-05",
      "name": "Castle Excellent (Japan), HSP-05",
      "size": 65552,
      "sha1": "42f7975da9a68a74e141353eb6e2bdc676fc1f77",
      "sha256": "fd6214cdc441070b9edab74b9c31ad16007bd0873e32c0c883de4544ca69f261",
      "container": "ines",
      "mapper": 3
    },
    {
      "id": "castlequest-usa",
      "name": "Castlequest (USA)",
      "size": 65552,
      "sha1": "600b0d2ae76722a62b42be02c0b0becd7ff0a178",
      "sha256": "35815cd107289a8273fb46dd7c49247a8217ca4e2a7f235fef3aa54566d0ba8c",
      "container": "ines",
      "mapper": 3
    }
  ],
  "resources": [
    {
      "id": "rooms",
      "kind": "room-collection",
      "codec": "castle.prefix-rooms.v1",
      "capacity_policy": "fixed",
      "parameters": {
        "room_count": 100,
        "width": 20,
        "height": 20,
        "codebook_cpu": 58461,
        "pointer_table_cpu": 59164,
        "fill_byte": 255,
        "arenas": [
          {
            "bank": 2,
            "first_room": 0,
            "last_room": 67,
            "start": 0,
            "end": 8192
          },
          {
            "bank": 3,
            "first_room": 67,
            "last_room": 100,
            "start": 0,
            "end": 5120
          }
        ]
      }
    },
    {
      "id": "objects",
      "kind": "object-layer",
      "codec": "castle.object-stream.v1",
      "capacity_policy": "fixed",
      "parameters": {
        "room_count": 100,
        "width": 20,
        "height": 20,
        "stream_cpu": 61291,
        "stream_end_cpu": 63740,
        "count_table_cpu": 43850,
        "state_offsets_cpu": 61190,
        "state_capacity": 141,
        "type_count": 61,
        "maximum_per_room": 24,
        "fill_byte": 255
      }
    },
    {
      "id": "mutable-cell-state",
      "kind": "derived-state-layout",
      "codec": "castle.mutable-cell-state.v1",
      "capacity_policy": "fixed",
      "parameters": {
        "state_offsets_cpu": 43950,
        "state_capacity": 108,
        "final_room_minimum_bytes": 3,
        "persistent_cell_values": [25, 28, 31, 34, 37, 41, 84]
      }
    },
    {
      "id": "room-rendering",
      "kind": "rendering-data",
      "codec": "castle.room-rendering.v1",
      "capacity_policy": "fixed",
      "parameters": {
        "chr_bank": 0,
        "chr_size": 8192,
        "room_palette_cpu": 50493,
        "room_palette_size": 32,
        "left_tiles_cpu": 65328,
        "right_tiles_cpu": 65428,
        "cell_attributes_cpu": 59858,
        "cell_count": 100,
        "initial_attributes_cpu": 47021,
        "initial_attributes_size": 16,
        "attribute_masks_cpu": 59667,
        "attribute_masks_size": 4,
        "attribute_preserving_cells": [9, 24, 27, 30, 33, 36, 39, 40, 43, 44, 45, 46, 83],
        "runtime_object_types_cpu": 60303,
        "runtime_object_type_count": 61,
        "metasprite_descriptors_cpu": 46262,
        "metasprite_descriptors_size": 406,
        "object_previews": [
          {"runtime_type": 129, "descriptor_cpu": 46484, "x_offsets": [0, 8]},
          {"runtime_type": 130, "descriptor_cpu": 46508, "x_offsets": [0, 8]},
          {"runtime_type": 131, "descriptor_cpu": 46524, "x_offsets": [0, 8]},
          {"runtime_type": 132, "descriptor_cpu": 46350, "x_offsets": [0, 8]},
          {"runtime_type": 133, "descriptor_cpu": 46358, "x_offsets": [0, 8]},
          {"runtime_type": 134, "descriptor_cpu": 46382, "x_offsets": [0]},
          {"runtime_type": 135, "descriptor_cpu": 46404, "x_offsets": [0, 8]},
          {"runtime_type": 136, "descriptor_cpu": 46428, "x_offsets": [0, 8]},
          {"runtime_type": 137, "descriptor_cpu": 46472, "x_offsets": [0, 8]},
          {"runtime_type": 138, "descriptor_cpu": 46528, "x_offsets": [0, 8]},
          {"runtime_type": 139, "descriptor_cpu": 46532, "x_offsets": [0, 8]},
          {"runtime_type": 140, "descriptor_cpu": 46536, "x_offsets": [0, 8]},
          {"runtime_type": 141, "descriptor_cpu": 46540, "x_offsets": [0, 8]},
          {"runtime_type": 142, "descriptor_cpu": 46544, "x_offsets": [0, 8]},
          {"runtime_type": 143, "descriptor_cpu": 46548, "x_offsets": [0, 8]},
          {"runtime_type": 144, "descriptor_cpu": 46512, "x_offsets": [0]},
          {"runtime_type": 145, "descriptor_cpu": 46514, "x_offsets": [0]},
          {"runtime_type": 146, "descriptor_cpu": 46516, "x_offsets": [0]},
          {"runtime_type": 147, "descriptor_cpu": 46518, "x_offsets": [0]},
          {"runtime_type": 148, "descriptor_cpu": 46520, "x_offsets": [0]},
          {"runtime_type": 149, "descriptor_cpu": 46522, "x_offsets": [0]},
          {"runtime_type": 150, "descriptor_cpu": 46556, "x_offsets": [0, 8]},
          {"runtime_type": 151, "descriptor_cpu": 46560, "x_offsets": [0, 8]},
          {"runtime_type": 152, "descriptor_cpu": 46564, "x_offsets": [0, 8]},
          {"runtime_type": 153, "descriptor_cpu": 46568, "x_offsets": [0, 8]},
          {"runtime_type": 154, "descriptor_cpu": 46572, "x_offsets": [0, 8]},
          {"runtime_type": 155, "descriptor_cpu": 46576, "x_offsets": [0, 8]},
          {"runtime_type": 159, "descriptor_cpu": 46600, "x_offsets": [0, 8]}
        ]
      }
    },
    {
      "id": "graphics-bundle",
      "kind": "resource-bundle",
      "codec": "nes.resource-bundle.v1",
      "capacity_policy": "fixed",
      "parameters": {
        "resource_ids": [
          "chr-bank-0",
          "chr-bank-1",
          "screen-palettes",
          "room-palettes",
          "room-cell-visuals",
          "metasprite-descriptors",
          "sub-command-text",
          "sfx-parameters",
          "music"
        ]
      }
    },
    {
      "id": "chr-bank-0",
      "kind": "graphics",
      "codec": "nes.chr-2bpp.v1",
      "capacity_policy": "fixed",
      "parameters": {
        "file_offset": 32784,
        "size": 8192
      }
    },
    {
      "id": "chr-bank-1",
      "kind": "graphics",
      "codec": "nes.chr-2bpp.v1",
      "capacity_policy": "fixed",
      "parameters": {
        "file_offset": 40976,
        "size": 8192
      }
    },
    {
      "id": "screen-palettes",
      "kind": "palette",
      "codec": "nes.palette-table.v1",
      "capacity_policy": "fixed",
      "parameters": {
        "file_offset": 17677,
        "size": 64,
        "entries": 64,
        "palette_model": "nes"
      }
    },
    {
      "id": "room-palettes",
      "kind": "palette",
      "codec": "nes.palette-table.v1",
      "capacity_policy": "fixed",
      "parameters": {
        "file_offset": 17741,
        "size": 32,
        "entries": 32,
        "palette_model": "nes"
      }
    },
    {
      "id": "room-cell-visuals",
      "kind": "metatile",
      "codec": "castle.room-cell-visuals.v1",
      "capacity_policy": "fixed",
      "parameters": {
        "cell_count": 100,
        "left_file_offset": 32576,
        "right_file_offset": 32676,
        "attributes_file_offset": 27106
      }
    },
    {
      "id": "metasprite-descriptors",
      "kind": "animation",
      "codec": "castle.metasprite-descriptors.v1",
      "capacity_policy": "fixed",
      "parameters": {
        "file_offset": 13510,
        "size": 406,
        "descriptor_count": 203
      }
    },
    {
      "id": "sub-command-text",
      "kind": "text",
      "codec": "castle.sub-command-text.v1",
      "capacity_policy": "fixed",
      "parameters": {
        "file_offset": 31623,
        "size": 53,
        "record_names": ["title", "load", "save", "reset", "back", "game", "loading", "saving"],
        "record_sizes": [12, 5, 5, 6, 5, 5, 8, 7]
      }
    },
    {
      "id": "sfx-parameters",
      "kind": "audio-parameter",
      "codec": "castle.sfx-parameters.v1",
      "capacity_policy": "fixed",
      "parameters": {
        "file_offset": 17465,
        "size": 20,
        "record_names": ["triangle_type_2_period_low", "inventory_period_low", "noise_type_4_volume", "noise_type_4_period", "noise_type_4_length"],
        "record_sizes": [4, 4, 4, 4, 4]
      }
    },
    {
      "id": "music",
      "kind": "audio",
      "codec": "castle.mml-music.v1",
      "capacity_policy": "fixed",
      "parameters": {
        "track_table_file_offset": 14550,
        "track_count": 8,
        "track_names": ["Room music", "Hazard protection", "Death / game over", "Invulnerability", "Castle completion", "Title screen", "Unreferenced selector", "Type $81 event"],
        "channel_names": ["Pulse 1", "Pulse 2", "Triangle"],
        "playback_prefix_file_offset": 15142,
        "playback_prefix_cpu_address": 47894,
        "playback_prefix_size": 209,
        "mml_file_offset": 15351,
        "mml_cpu_address": 48103,
        "mml_capacity": 1574,
        "stream_count": 21
      }
    }
  ]
}
